{
  "binding_status": "COMPLETE",
  "candidate_key": {
    "candidate_id": "candidate_3a2246627a7624c8d1d58bce",
    "candidate_version": "832618983b6c38e0250c49056709ac7e038848f62ba59f79720aed5ca3aa138e",
    "candidate_vi": "ma trận tương tác người dùng–sản phẩm",
    "dataset_manifest_sha256": "7b256808dacf446b06bc4f6cdc0ab8f0aa7585a2a4e3a56364cdb3508d17fbdc",
    "effective_sense_contract_sha256": "3845b33da847bda05d4b19d2254d8b5403c616247835654ae09bb011681ae95a",
    "scope_id": "d2l_selected_campaign_scope_v1",
    "sense_id": "d2lce_c01c503b792019c6e3827ac0",
    "sense_inventory_version": "d2l_dataset_50_senses_150_candidates_v1",
    "source_term": "interaction matrix"
  },
  "input_contract_sha256": "19dcaa8fc22b7169e59e74c3f85ebeb9930714010197e20a66f45a375c15e42c",
  "integrity": {
    "self_sha256": "6f212bbe939534a69f61e941646a41c62ed9cb54709c54e21d9d648ae0544b7f"
  },
  "polysemy_resolution": {
    "authority_ref": {
      "evidence_id": "review-binding-d2lce_c01c503b792019c6e3827ac0",
      "evidence_type": "REVIEW_ARTIFACT",
      "sha256": "95214158680369b86d28f2628ff9311019d898e3da9c8beb73fb1b503b962503",
      "uri": "artifact://d2l-dataset-50/stage_a_review_bindings/d2lce_c01c503b792019c6e3827ac0.json"
    },
    "related_sense_ids": [
      "d2lce_c01c503b792019c6e3827ac0"
    ],
    "status": "RESOLVED_SINGLE"
  },
  "provenance": {
    "completed_at": "2026-07-29T17:00:00Z",
    "component_id": "d2l-dataset-constraint-projector",
    "component_version": "1.0.0",
    "execution_config_sha256": "cf027ff8d20c1d2ecd0c667ab303fc31f25a9eda80257b61329c34e67efcd05d",
    "model_routes": [],
    "notes": "Stage A constraints are bound; candidate gold, C/E evidence, and final glossary decision remain unassigned.",
    "policy_version": "d2l-dataset-50-senses-150-candidates-stage-b-v1.0",
    "prompt_hashes": {},
    "raw_ledger_ref": null,
    "run_id": "d2l-dataset-50-sense-contract-release",
    "run_spec_id": "d2l-dataset-50-sense-contract-spec-v1",
    "source_artifact_hashes": {
      "adjudication_manifest": "95482cd1b495b9014a1f00ba4695324f99f0637c6fb96f17d5ffded44c5e2b5c",
      "base_dataset_manifest": "92fab6032576a5c9c57fe38e23b6c622d5f73718a897197a2c10df35c7fe8b4d",
      "base_dataset_manifest_physical": "438dffc84aaa735e4f734d4dc5cefcf63dc8360743b6e941380bca71eec1f13a",
      "candidate_instance": "832618983b6c38e0250c49056709ac7e038848f62ba59f79720aed5ca3aa138e",
      "r0_result_manifest": "c17198864aeb47233fd658d7e6c333c5beb86c5531e5b240ca30e046d066a616",
      "review_binding": "95214158680369b86d28f2628ff9311019d898e3da9c8beb73fb1b503b962503",
      "review_intake_manifest": "bcb840616060473ea61b81ca7cf052eff2ac00caeb7bff75e7cbf064e6a7e178",
      "term_sense": "59951150dc852b345ea59ab083d155f529025f8679741294c1ac75484416e9c8"
    },
    "started_at": "2026-07-29T17:00:00Z"
  },
  "schema_id": "ConstraintEvidencePackageV1",
  "schema_version": "1.1.0",
  "sense_review": {
    "effective_sense_contract_sha256": "3845b33da847bda05d4b19d2254d8b5403c616247835654ae09bb011681ae95a",
    "review_artifact_ref": {
      "evidence_id": "review-binding-d2lce_c01c503b792019c6e3827ac0",
      "evidence_type": "REVIEW_ARTIFACT",
      "sha256": "95214158680369b86d28f2628ff9311019d898e3da9c8beb73fb1b503b962503",
      "uri": "artifact://d2l-dataset-50/stage_a_review_bindings/d2lce_c01c503b792019c6e3827ac0.json"
    },
    "status": "VERIFIED"
  },
  "target_collision": {
    "collision_index_ref": null,
    "collision_index_sha256": null,
    "conflicting_candidate_keys": [],
    "evidence_refs": [],
    "status": "UNJUDGEABLE"
  }
}
