{
  "binding_status": "COMPLETE",
  "candidate_key": {
    "candidate_id": "candidate_bb742147b7734cbc775103a0",
    "candidate_version": "c1645abdf40de660d9c30185d13cfcae5afc71bd90b94da86647a58f21025a02",
    "candidate_vi": "R-CNN",
    "dataset_manifest_sha256": "7b256808dacf446b06bc4f6cdc0ab8f0aa7585a2a4e3a56364cdb3508d17fbdc",
    "effective_sense_contract_sha256": "2b235e2b025b22ce26e5adff1f7a72e0e48608ff7f9242a0c1205fb83683544b",
    "scope_id": "d2l_selected_campaign_scope_v1",
    "sense_id": "d2lce_ad0d7cbd5f90ad33075e89aa",
    "sense_inventory_version": "d2l_dataset_50_senses_150_candidates_v1",
    "source_term": "R-CNN"
  },
  "input_contract_sha256": "e246cb736bd7913921de94e862d6249df779fb6dd41807881d82cb8e48a842f8",
  "integrity": {
    "self_sha256": "f014ba0818d63da237984d73306844f2a337b1dc50bcee1dfd8e1a22822876e2"
  },
  "polysemy_resolution": {
    "authority_ref": {
      "evidence_id": "review-binding-d2lce_ad0d7cbd5f90ad33075e89aa",
      "evidence_type": "REVIEW_ARTIFACT",
      "sha256": "0f6dfa767633b7ea4c427a8974f5359a6bae014067062a0d1a0e44a377db4050",
      "uri": "artifact://d2l-dataset-50/stage_a_review_bindings/d2lce_ad0d7cbd5f90ad33075e89aa.json"
    },
    "related_sense_ids": [
      "d2lce_ad0d7cbd5f90ad33075e89aa"
    ],
    "status": "RESOLVED_SINGLE"
  },
  "provenance": {
    "completed_at": "2026-07-29T17:00:00Z",
    "component_id": "d2l-dataset-constraint-projector",
    "component_version": "1.0.0",
    "execution_config_sha256": "cf027ff8d20c1d2ecd0c667ab303fc31f25a9eda80257b61329c34e67efcd05d",
    "model_routes": [],
    "notes": "Stage A constraints are bound; candidate gold, C/E evidence, and final glossary decision remain unassigned.",
    "policy_version": "d2l-dataset-50-senses-150-candidates-stage-b-v1.0",
    "prompt_hashes": {},
    "raw_ledger_ref": null,
    "run_id": "d2l-dataset-50-sense-contract-release",
    "run_spec_id": "d2l-dataset-50-sense-contract-spec-v1",
    "source_artifact_hashes": {
      "adjudication_manifest": "95482cd1b495b9014a1f00ba4695324f99f0637c6fb96f17d5ffded44c5e2b5c",
      "base_dataset_manifest": "92fab6032576a5c9c57fe38e23b6c622d5f73718a897197a2c10df35c7fe8b4d",
      "base_dataset_manifest_physical": "438dffc84aaa735e4f734d4dc5cefcf63dc8360743b6e941380bca71eec1f13a",
      "candidate_instance": "c1645abdf40de660d9c30185d13cfcae5afc71bd90b94da86647a58f21025a02",
      "r0_result_manifest": "c17198864aeb47233fd658d7e6c333c5beb86c5531e5b240ca30e046d066a616",
      "review_binding": "0f6dfa767633b7ea4c427a8974f5359a6bae014067062a0d1a0e44a377db4050",
      "review_intake_manifest": "bcb840616060473ea61b81ca7cf052eff2ac00caeb7bff75e7cbf064e6a7e178",
      "term_sense": "8e82a266f7438d7470aec3d268d452ba9fbaea474ba0a36586d92b410095b9bf"
    },
    "started_at": "2026-07-29T17:00:00Z"
  },
  "schema_id": "ConstraintEvidencePackageV1",
  "schema_version": "1.1.0",
  "sense_review": {
    "effective_sense_contract_sha256": "2b235e2b025b22ce26e5adff1f7a72e0e48608ff7f9242a0c1205fb83683544b",
    "review_artifact_ref": {
      "evidence_id": "review-binding-d2lce_ad0d7cbd5f90ad33075e89aa",
      "evidence_type": "REVIEW_ARTIFACT",
      "sha256": "0f6dfa767633b7ea4c427a8974f5359a6bae014067062a0d1a0e44a377db4050",
      "uri": "artifact://d2l-dataset-50/stage_a_review_bindings/d2lce_ad0d7cbd5f90ad33075e89aa.json"
    },
    "status": "VERIFIED"
  },
  "target_collision": {
    "collision_index_ref": null,
    "collision_index_sha256": null,
    "conflicting_candidate_keys": [],
    "evidence_refs": [],
    "status": "UNJUDGEABLE"
  }
}
