{
  "binding_status": "COMPLETE",
  "candidate_key": {
    "candidate_id": "candidate_270b146d405d67d006648a35",
    "candidate_version": "81ee81bb44261ea5f6c9a509919e8270828931531ac67e821045eac360631100",
    "candidate_vi": "đang được áp dụng",
    "dataset_manifest_sha256": "7b256808dacf446b06bc4f6cdc0ab8f0aa7585a2a4e3a56364cdb3508d17fbdc",
    "effective_sense_contract_sha256": "d6898a9905f805de6b648181e18c7b105c0324168225fb61413089260f564f8d",
    "scope_id": "SYSTEM_COMPONENT_OR_PROCESS_READINESS",
    "sense_id": "d2lce_51ce8cc13680668af18c9d10",
    "sense_inventory_version": "d2l_dataset_50_senses_150_candidates_v1",
    "source_term": "in place"
  },
  "input_contract_sha256": "328d9b37c9a9a4db3ee08003d4f4d51540686eb5e0e3a29495048fa684e3e7b9",
  "integrity": {
    "self_sha256": "0c407d37fe67868600eb367bc49ba5f4c93bf8fe237c3ff7c6067c7e8226b604"
  },
  "polysemy_resolution": {
    "authority_ref": {
      "evidence_id": "review-binding-d2lce_51ce8cc13680668af18c9d10",
      "evidence_type": "REVIEW_ARTIFACT",
      "sha256": "a2c37b2655e22ceb37c31761ea588f6f97bc5999ddd7fd0e76f67cdb31e9a187",
      "uri": "artifact://d2l-dataset-50/stage_a_review_bindings/d2lce_51ce8cc13680668af18c9d10.json"
    },
    "related_sense_ids": [
      "d2lce_51ce8cc13680668af18c9d10"
    ],
    "status": "RESOLVED_SINGLE"
  },
  "provenance": {
    "completed_at": "2026-07-29T17:00:00Z",
    "component_id": "d2l-dataset-constraint-projector",
    "component_version": "1.0.0",
    "execution_config_sha256": "cf027ff8d20c1d2ecd0c667ab303fc31f25a9eda80257b61329c34e67efcd05d",
    "model_routes": [],
    "notes": "Stage A constraints are bound; candidate gold, C/E evidence, and final glossary decision remain unassigned.",
    "policy_version": "d2l-dataset-50-senses-150-candidates-stage-b-v1.0",
    "prompt_hashes": {},
    "raw_ledger_ref": null,
    "run_id": "d2l-dataset-50-sense-contract-release",
    "run_spec_id": "d2l-dataset-50-sense-contract-spec-v1",
    "source_artifact_hashes": {
      "adjudication_manifest": "95482cd1b495b9014a1f00ba4695324f99f0637c6fb96f17d5ffded44c5e2b5c",
      "base_dataset_manifest": "92fab6032576a5c9c57fe38e23b6c622d5f73718a897197a2c10df35c7fe8b4d",
      "base_dataset_manifest_physical": "438dffc84aaa735e4f734d4dc5cefcf63dc8360743b6e941380bca71eec1f13a",
      "candidate_instance": "81ee81bb44261ea5f6c9a509919e8270828931531ac67e821045eac360631100",
      "r0_result_manifest": "c17198864aeb47233fd658d7e6c333c5beb86c5531e5b240ca30e046d066a616",
      "review_binding": "a2c37b2655e22ceb37c31761ea588f6f97bc5999ddd7fd0e76f67cdb31e9a187",
      "review_intake_manifest": "bcb840616060473ea61b81ca7cf052eff2ac00caeb7bff75e7cbf064e6a7e178",
      "term_sense": "7ac2b7adb16956b82ab9dcfdc2bbd647beee7d1f5f1084a6e8c573bfaea0577e"
    },
    "started_at": "2026-07-29T17:00:00Z"
  },
  "schema_id": "ConstraintEvidencePackageV1",
  "schema_version": "1.1.0",
  "sense_review": {
    "effective_sense_contract_sha256": "d6898a9905f805de6b648181e18c7b105c0324168225fb61413089260f564f8d",
    "review_artifact_ref": {
      "evidence_id": "review-binding-d2lce_51ce8cc13680668af18c9d10",
      "evidence_type": "REVIEW_ARTIFACT",
      "sha256": "a2c37b2655e22ceb37c31761ea588f6f97bc5999ddd7fd0e76f67cdb31e9a187",
      "uri": "artifact://d2l-dataset-50/stage_a_review_bindings/d2lce_51ce8cc13680668af18c9d10.json"
    },
    "status": "VERIFIED"
  },
  "target_collision": {
    "collision_index_ref": null,
    "collision_index_sha256": null,
    "conflicting_candidate_keys": [],
    "evidence_refs": [],
    "status": "UNJUDGEABLE"
  }
}
