{
  "binding_status": "COMPLETE",
  "candidate_key": {
    "candidate_id": "candidate_a17d27ba34e4fe72d21bc2c7",
    "candidate_version": "49e5f68cfa0e45805b105a4623e432442391e0a00eff0fe6a1350901687333de",
    "candidate_vi": "lớp pooling",
    "dataset_manifest_sha256": "7b256808dacf446b06bc4f6cdc0ab8f0aa7585a2a4e3a56364cdb3508d17fbdc",
    "effective_sense_contract_sha256": "611abc4b8dc2d0b934f648a8a3424ba1a3859687557c7ec3c1e85a8de83ce902",
    "scope_id": "d2l_selected_campaign_scope_v1",
    "sense_id": "d2lce_2b9f63478b6ef59511a4f930",
    "sense_inventory_version": "d2l_dataset_50_senses_150_candidates_v1",
    "source_term": "pooling layer"
  },
  "input_contract_sha256": "b05193b0fcee5a056f076e754ddb8cb1bc8e09fb6304f489f603801430c7c4b6",
  "integrity": {
    "self_sha256": "fffc1e1ace8856a70a7db904b611b1ebbe9c51e632cf584b608d59956b74a22e"
  },
  "polysemy_resolution": {
    "authority_ref": {
      "evidence_id": "review-binding-d2lce_2b9f63478b6ef59511a4f930",
      "evidence_type": "REVIEW_ARTIFACT",
      "sha256": "da21a383cd7c3f8de50c0e060453adcb347319dc6b6534075bb56f0184794087",
      "uri": "artifact://d2l-dataset-50/stage_a_review_bindings/d2lce_2b9f63478b6ef59511a4f930.json"
    },
    "related_sense_ids": [
      "d2lce_2b9f63478b6ef59511a4f930"
    ],
    "status": "RESOLVED_SINGLE"
  },
  "provenance": {
    "completed_at": "2026-07-29T17:00:00Z",
    "component_id": "d2l-dataset-constraint-projector",
    "component_version": "1.0.0",
    "execution_config_sha256": "cf027ff8d20c1d2ecd0c667ab303fc31f25a9eda80257b61329c34e67efcd05d",
    "model_routes": [],
    "notes": "Stage A constraints are bound; candidate gold, C/E evidence, and final glossary decision remain unassigned.",
    "policy_version": "d2l-dataset-50-senses-150-candidates-stage-b-v1.0",
    "prompt_hashes": {},
    "raw_ledger_ref": null,
    "run_id": "d2l-dataset-50-sense-contract-release",
    "run_spec_id": "d2l-dataset-50-sense-contract-spec-v1",
    "source_artifact_hashes": {
      "adjudication_manifest": "95482cd1b495b9014a1f00ba4695324f99f0637c6fb96f17d5ffded44c5e2b5c",
      "base_dataset_manifest": "92fab6032576a5c9c57fe38e23b6c622d5f73718a897197a2c10df35c7fe8b4d",
      "base_dataset_manifest_physical": "438dffc84aaa735e4f734d4dc5cefcf63dc8360743b6e941380bca71eec1f13a",
      "candidate_instance": "49e5f68cfa0e45805b105a4623e432442391e0a00eff0fe6a1350901687333de",
      "r0_result_manifest": "c17198864aeb47233fd658d7e6c333c5beb86c5531e5b240ca30e046d066a616",
      "review_binding": "da21a383cd7c3f8de50c0e060453adcb347319dc6b6534075bb56f0184794087",
      "review_intake_manifest": "bcb840616060473ea61b81ca7cf052eff2ac00caeb7bff75e7cbf064e6a7e178",
      "term_sense": "b4fcb0bca060cc1ca823d150fce83d1a7ff77a257e699166c344c3e18ce07cf7"
    },
    "started_at": "2026-07-29T17:00:00Z"
  },
  "schema_id": "ConstraintEvidencePackageV1",
  "schema_version": "1.1.0",
  "sense_review": {
    "effective_sense_contract_sha256": "611abc4b8dc2d0b934f648a8a3424ba1a3859687557c7ec3c1e85a8de83ce902",
    "review_artifact_ref": {
      "evidence_id": "review-binding-d2lce_2b9f63478b6ef59511a4f930",
      "evidence_type": "REVIEW_ARTIFACT",
      "sha256": "da21a383cd7c3f8de50c0e060453adcb347319dc6b6534075bb56f0184794087",
      "uri": "artifact://d2l-dataset-50/stage_a_review_bindings/d2lce_2b9f63478b6ef59511a4f930.json"
    },
    "status": "VERIFIED"
  },
  "target_collision": {
    "collision_index_ref": null,
    "collision_index_sha256": null,
    "conflicting_candidate_keys": [],
    "evidence_refs": [],
    "status": "UNJUDGEABLE"
  }
}
