{
  "binding_status": "COMPLETE",
  "candidate_key": {
    "candidate_id": "candidate_9a71121fcd6518d56de52f9c",
    "candidate_version": "fe73508373389bcb66f18476b48d0848a1ffb03e09f11e5c29c2b1cae1d0c197",
    "candidate_vi": "động lượng",
    "dataset_manifest_sha256": "258ebe5d907a0a108a1b80a1ec1aad3c6e265ed1a8edbd5701cc128e273122ce",
    "effective_sense_contract_sha256": "4df321b82f7fb1af722e4650ab4c9570bfd61f80716f780fb20ec9c91eb76096",
    "scope_id": "d2l_selected_campaign_scope_v1",
    "sense_id": "d2lce_addfcc9899bef06c500b6b0e",
    "sense_inventory_version": "d2l_context_support_set_validation_ready_v3",
    "source_term": "momentum"
  },
  "input_contract_sha256": "062527983e156018465e22a6bd935e55c389bc0ab3ab04eb9d08eb8509a34e69",
  "integrity": {
    "self_sha256": "931590dab850248fa604258050d7483da4ed01dcd62801f3ee33c9c2a40d4b78"
  },
  "polysemy_resolution": {
    "authority_ref": {
      "evidence_id": "review-binding-d2lce_addfcc9899bef06c500b6b0e",
      "evidence_type": "REVIEW_ARTIFACT",
      "sha256": "5911461fb266ac67514ee6ea92f22f9cbeced6023d5821e1c3e79d6325cd5036",
      "uri": "artifact://d2l-stage-a-p0b/review_bindings_11/d2lce_addfcc9899bef06c500b6b0e.json"
    },
    "related_sense_ids": [
      "d2lce_addfcc9899bef06c500b6b0e"
    ],
    "status": "RESOLVED_SINGLE"
  },
  "provenance": {
    "completed_at": "2026-07-29T08:00:00Z",
    "component_id": "d2l-dataset-constraint-projector",
    "component_version": "1.0.0",
    "execution_config_sha256": "c0a8a26c215ffdd4a5c3586c500adfc4cb7b86691b47f0ba6990857f7bb43e61",
    "model_routes": [],
    "notes": "Sense review and polysemy are bound; target collision remains explicitly unjudgeable for downstream review.",
    "policy_version": "d2l-stage-a-p0b-official-11-sense-v1.0",
    "prompt_hashes": {},
    "raw_ledger_ref": null,
    "run_id": "d2l-stage-a-p0b-official-11-sense-release",
    "run_spec_id": "d2l-stage-a-p0b-official-11-sense-spec-v1",
    "source_artifact_hashes": {
      "candidate_instance": "fe73508373389bcb66f18476b48d0848a1ffb03e09f11e5c29c2b1cae1d0c197",
      "dataset_manifest": "258ebe5d907a0a108a1b80a1ec1aad3c6e265ed1a8edbd5701cc128e273122ce",
      "review_binding": "5911461fb266ac67514ee6ea92f22f9cbeced6023d5821e1c3e79d6325cd5036",
      "reviewed_manifest": "e602af02edf1fb877a9541c5e37f939f4f35ded34ac878d773fc83b96ed3fb48",
      "term_sense": "9a08ab5c8f8d96ee186c76eedfd5c4e522269ada60f4ec1ae3da5fe961446b3c"
    },
    "started_at": "2026-07-29T08:00:00Z"
  },
  "schema_id": "ConstraintEvidencePackageV1",
  "schema_version": "1.1.0",
  "sense_review": {
    "effective_sense_contract_sha256": "4df321b82f7fb1af722e4650ab4c9570bfd61f80716f780fb20ec9c91eb76096",
    "review_artifact_ref": {
      "evidence_id": "review-binding-d2lce_addfcc9899bef06c500b6b0e",
      "evidence_type": "REVIEW_ARTIFACT",
      "sha256": "5911461fb266ac67514ee6ea92f22f9cbeced6023d5821e1c3e79d6325cd5036",
      "uri": "artifact://d2l-stage-a-p0b/review_bindings_11/d2lce_addfcc9899bef06c500b6b0e.json"
    },
    "status": "VERIFIED"
  },
  "target_collision": {
    "collision_index_ref": null,
    "collision_index_sha256": null,
    "conflicting_candidate_keys": [],
    "evidence_refs": [],
    "status": "UNJUDGEABLE"
  }
}
