{
  "binding_status": "COMPLETE",
  "candidate_key": {
    "candidate_id": "candidate_86faacf2fd5a8b76c806b607",
    "candidate_version": "4564c1ae5bb4d10e2ec782a34c40d0feb33a4d6a37724685e5b7fc45dba66ad0",
    "candidate_vi": "lớp chập chuyển vị",
    "dataset_manifest_sha256": "7b256808dacf446b06bc4f6cdc0ab8f0aa7585a2a4e3a56364cdb3508d17fbdc",
    "effective_sense_contract_sha256": "2eb2d280615a5fdc04871e65e857ca0de45027f257aa897f1506fe0fd786f921",
    "scope_id": "d2l_selected_campaign_scope_v1",
    "sense_id": "d2lce_b63485c15ac13f80b0d98676",
    "sense_inventory_version": "d2l_dataset_50_senses_150_candidates_v1",
    "source_term": "transposed convolutional layer"
  },
  "input_contract_sha256": "a7a59f09b020dfe11a5b0f5908f52af6a1398f9602bc329044abc5b17912e976",
  "integrity": {
    "self_sha256": "3cf840020c8471b6b07615b799ddb5ba1e8468fa38073a4b5fd86a707aefb3bd"
  },
  "polysemy_resolution": {
    "authority_ref": {
      "evidence_id": "review-binding-d2lce_b63485c15ac13f80b0d98676",
      "evidence_type": "REVIEW_ARTIFACT",
      "sha256": "5c7c28a0e32ff5d05ad0f7cf10587aee47c65cc7fc770f9906479cef8c86c8c5",
      "uri": "artifact://d2l-dataset-50/stage_a_review_bindings/d2lce_b63485c15ac13f80b0d98676.json"
    },
    "related_sense_ids": [
      "d2lce_b63485c15ac13f80b0d98676"
    ],
    "status": "RESOLVED_SINGLE"
  },
  "provenance": {
    "completed_at": "2026-07-29T17:00:00Z",
    "component_id": "d2l-dataset-constraint-projector",
    "component_version": "1.0.0",
    "execution_config_sha256": "cf027ff8d20c1d2ecd0c667ab303fc31f25a9eda80257b61329c34e67efcd05d",
    "model_routes": [],
    "notes": "Stage A constraints are bound; candidate gold, C/E evidence, and final glossary decision remain unassigned.",
    "policy_version": "d2l-dataset-50-senses-150-candidates-stage-b-v1.0",
    "prompt_hashes": {},
    "raw_ledger_ref": null,
    "run_id": "d2l-dataset-50-sense-contract-release",
    "run_spec_id": "d2l-dataset-50-sense-contract-spec-v1",
    "source_artifact_hashes": {
      "adjudication_manifest": "95482cd1b495b9014a1f00ba4695324f99f0637c6fb96f17d5ffded44c5e2b5c",
      "base_dataset_manifest": "92fab6032576a5c9c57fe38e23b6c622d5f73718a897197a2c10df35c7fe8b4d",
      "base_dataset_manifest_physical": "438dffc84aaa735e4f734d4dc5cefcf63dc8360743b6e941380bca71eec1f13a",
      "candidate_instance": "4564c1ae5bb4d10e2ec782a34c40d0feb33a4d6a37724685e5b7fc45dba66ad0",
      "r0_result_manifest": "c17198864aeb47233fd658d7e6c333c5beb86c5531e5b240ca30e046d066a616",
      "review_binding": "5c7c28a0e32ff5d05ad0f7cf10587aee47c65cc7fc770f9906479cef8c86c8c5",
      "review_intake_manifest": "bcb840616060473ea61b81ca7cf052eff2ac00caeb7bff75e7cbf064e6a7e178",
      "term_sense": "56c7a34d9db452503075191953e81cf3ec3dd8d595547017125332da24e12b87"
    },
    "started_at": "2026-07-29T17:00:00Z"
  },
  "schema_id": "ConstraintEvidencePackageV1",
  "schema_version": "1.1.0",
  "sense_review": {
    "effective_sense_contract_sha256": "2eb2d280615a5fdc04871e65e857ca0de45027f257aa897f1506fe0fd786f921",
    "review_artifact_ref": {
      "evidence_id": "review-binding-d2lce_b63485c15ac13f80b0d98676",
      "evidence_type": "REVIEW_ARTIFACT",
      "sha256": "5c7c28a0e32ff5d05ad0f7cf10587aee47c65cc7fc770f9906479cef8c86c8c5",
      "uri": "artifact://d2l-dataset-50/stage_a_review_bindings/d2lce_b63485c15ac13f80b0d98676.json"
    },
    "status": "VERIFIED"
  },
  "target_collision": {
    "collision_index_ref": null,
    "collision_index_sha256": null,
    "conflicting_candidate_keys": [],
    "evidence_refs": [],
    "status": "UNJUDGEABLE"
  }
}
