{
  "binding_status": "COMPLETE",
  "candidate_key": {
    "candidate_id": "candidate_6c14b83609eee2c9a6b7f4bb",
    "candidate_version": "8a0526cfd6dda0bd1caf917114ea8d1fea6eb84142951e7ab29924dafcd544c6",
    "candidate_vi": "hàm kích hoạt sigmoid",
    "dataset_manifest_sha256": "7b256808dacf446b06bc4f6cdc0ab8f0aa7585a2a4e3a56364cdb3508d17fbdc",
    "effective_sense_contract_sha256": "7826f33929e70cde473556871097aace884ef822feb64048266689253fd26c53",
    "scope_id": "d2l_selected_campaign_scope_v1",
    "sense_id": "d2lce_00f50f89defd8652bb8c429e",
    "sense_inventory_version": "d2l_dataset_50_senses_150_candidates_v1",
    "source_term": "sigmoid function"
  },
  "input_contract_sha256": "234bb48dd4e6deffc49027fffa2209efb406aecb3e875329f32f799e920c8282",
  "integrity": {
    "self_sha256": "1b195a9fb6dab746a877f0e3e8b04477ebb44b62abf5cf7319534a418ef869f5"
  },
  "polysemy_resolution": {
    "authority_ref": {
      "evidence_id": "review-binding-d2lce_00f50f89defd8652bb8c429e",
      "evidence_type": "REVIEW_ARTIFACT",
      "sha256": "a901bff09376f9905319dd35468d1ce3bd946f8aabc77d4683f6b4f3cba2872d",
      "uri": "artifact://d2l-dataset-50/stage_a_review_bindings/d2lce_00f50f89defd8652bb8c429e.json"
    },
    "related_sense_ids": [
      "d2lce_00f50f89defd8652bb8c429e"
    ],
    "status": "RESOLVED_SINGLE"
  },
  "provenance": {
    "completed_at": "2026-07-29T17:00:00Z",
    "component_id": "d2l-dataset-constraint-projector",
    "component_version": "1.0.0",
    "execution_config_sha256": "cf027ff8d20c1d2ecd0c667ab303fc31f25a9eda80257b61329c34e67efcd05d",
    "model_routes": [],
    "notes": "Stage A constraints are bound; candidate gold, C/E evidence, and final glossary decision remain unassigned.",
    "policy_version": "d2l-dataset-50-senses-150-candidates-stage-b-v1.0",
    "prompt_hashes": {},
    "raw_ledger_ref": null,
    "run_id": "d2l-dataset-50-sense-contract-release",
    "run_spec_id": "d2l-dataset-50-sense-contract-spec-v1",
    "source_artifact_hashes": {
      "adjudication_manifest": "95482cd1b495b9014a1f00ba4695324f99f0637c6fb96f17d5ffded44c5e2b5c",
      "base_dataset_manifest": "92fab6032576a5c9c57fe38e23b6c622d5f73718a897197a2c10df35c7fe8b4d",
      "base_dataset_manifest_physical": "438dffc84aaa735e4f734d4dc5cefcf63dc8360743b6e941380bca71eec1f13a",
      "candidate_instance": "8a0526cfd6dda0bd1caf917114ea8d1fea6eb84142951e7ab29924dafcd544c6",
      "r0_result_manifest": "c17198864aeb47233fd658d7e6c333c5beb86c5531e5b240ca30e046d066a616",
      "review_binding": "a901bff09376f9905319dd35468d1ce3bd946f8aabc77d4683f6b4f3cba2872d",
      "review_intake_manifest": "bcb840616060473ea61b81ca7cf052eff2ac00caeb7bff75e7cbf064e6a7e178",
      "term_sense": "1e4d01f237a069251c75d2e88265b4271c245a91c4a7c591b925d953295efc31"
    },
    "started_at": "2026-07-29T17:00:00Z"
  },
  "schema_id": "ConstraintEvidencePackageV1",
  "schema_version": "1.1.0",
  "sense_review": {
    "effective_sense_contract_sha256": "7826f33929e70cde473556871097aace884ef822feb64048266689253fd26c53",
    "review_artifact_ref": {
      "evidence_id": "review-binding-d2lce_00f50f89defd8652bb8c429e",
      "evidence_type": "REVIEW_ARTIFACT",
      "sha256": "a901bff09376f9905319dd35468d1ce3bd946f8aabc77d4683f6b4f3cba2872d",
      "uri": "artifact://d2l-dataset-50/stage_a_review_bindings/d2lce_00f50f89defd8652bb8c429e.json"
    },
    "status": "VERIFIED"
  },
  "target_collision": {
    "collision_index_ref": null,
    "collision_index_sha256": null,
    "conflicting_candidate_keys": [],
    "evidence_refs": [],
    "status": "UNJUDGEABLE"
  }
}
