{
  "binding_status": "COMPLETE",
  "candidate_key": {
    "candidate_id": "candidate_ef1b5a0693c5a2a06c8d894b",
    "candidate_version": "cbed98d19b29386b8808482cde3db62fc7db5475ab64375c307f11b9ae2d67b1",
    "candidate_vi": "cổng đầu vào LSTM",
    "dataset_manifest_sha256": "7b256808dacf446b06bc4f6cdc0ab8f0aa7585a2a4e3a56364cdb3508d17fbdc",
    "effective_sense_contract_sha256": "ad1b380d783021d1b0837d82d0cba9408c5c062940dd81d545a8624e951c642b",
    "scope_id": "d2l_selected_campaign_scope_v1",
    "sense_id": "d2lce_c6c1c6e96c39b88a9f94e8d9",
    "sense_inventory_version": "d2l_dataset_50_senses_150_candidates_v1",
    "source_term": "input gate"
  },
  "input_contract_sha256": "b3bc50c8822adeb12edd17d6bdf9425c55aa295a7c2d34d618ec854a7b3e6bf8",
  "integrity": {
    "self_sha256": "ac6941f840abf33c7678b3ecb6f5d579c2f27faf4c27229f85745a5247541de7"
  },
  "polysemy_resolution": {
    "authority_ref": {
      "evidence_id": "review-binding-d2lce_c6c1c6e96c39b88a9f94e8d9",
      "evidence_type": "REVIEW_ARTIFACT",
      "sha256": "e9d386fb3a508813a88814222b11db08893964f2ea732ea1af6ee6596b7e087f",
      "uri": "artifact://d2l-dataset-50/stage_a_review_bindings/d2lce_c6c1c6e96c39b88a9f94e8d9.json"
    },
    "related_sense_ids": [
      "d2lce_c6c1c6e96c39b88a9f94e8d9"
    ],
    "status": "RESOLVED_SINGLE"
  },
  "provenance": {
    "completed_at": "2026-07-29T17:00:00Z",
    "component_id": "d2l-dataset-constraint-projector",
    "component_version": "1.0.0",
    "execution_config_sha256": "cf027ff8d20c1d2ecd0c667ab303fc31f25a9eda80257b61329c34e67efcd05d",
    "model_routes": [],
    "notes": "Stage A constraints are bound; candidate gold, C/E evidence, and final glossary decision remain unassigned.",
    "policy_version": "d2l-dataset-50-senses-150-candidates-stage-b-v1.0",
    "prompt_hashes": {},
    "raw_ledger_ref": null,
    "run_id": "d2l-dataset-50-sense-contract-release",
    "run_spec_id": "d2l-dataset-50-sense-contract-spec-v1",
    "source_artifact_hashes": {
      "adjudication_manifest": "95482cd1b495b9014a1f00ba4695324f99f0637c6fb96f17d5ffded44c5e2b5c",
      "base_dataset_manifest": "92fab6032576a5c9c57fe38e23b6c622d5f73718a897197a2c10df35c7fe8b4d",
      "base_dataset_manifest_physical": "438dffc84aaa735e4f734d4dc5cefcf63dc8360743b6e941380bca71eec1f13a",
      "candidate_instance": "cbed98d19b29386b8808482cde3db62fc7db5475ab64375c307f11b9ae2d67b1",
      "r0_result_manifest": "c17198864aeb47233fd658d7e6c333c5beb86c5531e5b240ca30e046d066a616",
      "review_binding": "e9d386fb3a508813a88814222b11db08893964f2ea732ea1af6ee6596b7e087f",
      "review_intake_manifest": "bcb840616060473ea61b81ca7cf052eff2ac00caeb7bff75e7cbf064e6a7e178",
      "term_sense": "75c7cf5c3ee401084d0c964b4c2ace4929f209e7731346239be43b13bdc92fb3"
    },
    "started_at": "2026-07-29T17:00:00Z"
  },
  "schema_id": "ConstraintEvidencePackageV1",
  "schema_version": "1.1.0",
  "sense_review": {
    "effective_sense_contract_sha256": "ad1b380d783021d1b0837d82d0cba9408c5c062940dd81d545a8624e951c642b",
    "review_artifact_ref": {
      "evidence_id": "review-binding-d2lce_c6c1c6e96c39b88a9f94e8d9",
      "evidence_type": "REVIEW_ARTIFACT",
      "sha256": "e9d386fb3a508813a88814222b11db08893964f2ea732ea1af6ee6596b7e087f",
      "uri": "artifact://d2l-dataset-50/stage_a_review_bindings/d2lce_c6c1c6e96c39b88a9f94e8d9.json"
    },
    "status": "VERIFIED"
  },
  "target_collision": {
    "collision_index_ref": null,
    "collision_index_sha256": null,
    "conflicting_candidate_keys": [],
    "evidence_refs": [],
    "status": "UNJUDGEABLE"
  }
}
