{
  "binding_status": "COMPLETE",
  "candidate_key": {
    "candidate_id": "candidate_aaf6d2b452a6b41bec5670cd",
    "candidate_version": "f1134f99842a5caaf4adbd40ba771b8cd019b85adfc65b601272c6bfae015aad",
    "candidate_vi": "hàm chấm điểm chú ý",
    "dataset_manifest_sha256": "7b256808dacf446b06bc4f6cdc0ab8f0aa7585a2a4e3a56364cdb3508d17fbdc",
    "effective_sense_contract_sha256": "604061ba384cb3438a92e27759a9db8098a7fb6323196600ca4dc5d5a1bca63f",
    "scope_id": "d2l_selected_campaign_scope_v1",
    "sense_id": "d2lce_18c3da2d5bdd6d05a83982fa",
    "sense_inventory_version": "d2l_dataset_50_senses_150_candidates_v1",
    "source_term": "attention scoring function"
  },
  "input_contract_sha256": "2db023c8b96d9ce01e34ff31268c5660cdce88d4c32d215105a2d30b31ffedfe",
  "integrity": {
    "self_sha256": "ca236ff49559bc489669d3f191fc4cfa0414cf5491a636b27bc3a83344e8140b"
  },
  "polysemy_resolution": {
    "authority_ref": {
      "evidence_id": "review-binding-d2lce_18c3da2d5bdd6d05a83982fa",
      "evidence_type": "REVIEW_ARTIFACT",
      "sha256": "810dae00b97092ca45b5727cf2b7a42e6415ec3b18c10fecfd73d6c9ad8199f2",
      "uri": "artifact://d2l-dataset-50/stage_a_review_bindings/d2lce_18c3da2d5bdd6d05a83982fa.json"
    },
    "related_sense_ids": [
      "d2lce_18c3da2d5bdd6d05a83982fa"
    ],
    "status": "RESOLVED_SINGLE"
  },
  "provenance": {
    "completed_at": "2026-07-29T17:00:00Z",
    "component_id": "d2l-dataset-constraint-projector",
    "component_version": "1.0.0",
    "execution_config_sha256": "cf027ff8d20c1d2ecd0c667ab303fc31f25a9eda80257b61329c34e67efcd05d",
    "model_routes": [],
    "notes": "Stage A constraints are bound; candidate gold, C/E evidence, and final glossary decision remain unassigned.",
    "policy_version": "d2l-dataset-50-senses-150-candidates-stage-b-v1.0",
    "prompt_hashes": {},
    "raw_ledger_ref": null,
    "run_id": "d2l-dataset-50-sense-contract-release",
    "run_spec_id": "d2l-dataset-50-sense-contract-spec-v1",
    "source_artifact_hashes": {
      "adjudication_manifest": "95482cd1b495b9014a1f00ba4695324f99f0637c6fb96f17d5ffded44c5e2b5c",
      "base_dataset_manifest": "92fab6032576a5c9c57fe38e23b6c622d5f73718a897197a2c10df35c7fe8b4d",
      "base_dataset_manifest_physical": "438dffc84aaa735e4f734d4dc5cefcf63dc8360743b6e941380bca71eec1f13a",
      "candidate_instance": "f1134f99842a5caaf4adbd40ba771b8cd019b85adfc65b601272c6bfae015aad",
      "r0_result_manifest": "c17198864aeb47233fd658d7e6c333c5beb86c5531e5b240ca30e046d066a616",
      "review_binding": "810dae00b97092ca45b5727cf2b7a42e6415ec3b18c10fecfd73d6c9ad8199f2",
      "review_intake_manifest": "bcb840616060473ea61b81ca7cf052eff2ac00caeb7bff75e7cbf064e6a7e178",
      "term_sense": "3fef003e5944803c67188d1ed84553a9c9373867fa850277f15fbccfbc3bca11"
    },
    "started_at": "2026-07-29T17:00:00Z"
  },
  "schema_id": "ConstraintEvidencePackageV1",
  "schema_version": "1.1.0",
  "sense_review": {
    "effective_sense_contract_sha256": "604061ba384cb3438a92e27759a9db8098a7fb6323196600ca4dc5d5a1bca63f",
    "review_artifact_ref": {
      "evidence_id": "review-binding-d2lce_18c3da2d5bdd6d05a83982fa",
      "evidence_type": "REVIEW_ARTIFACT",
      "sha256": "810dae00b97092ca45b5727cf2b7a42e6415ec3b18c10fecfd73d6c9ad8199f2",
      "uri": "artifact://d2l-dataset-50/stage_a_review_bindings/d2lce_18c3da2d5bdd6d05a83982fa.json"
    },
    "status": "VERIFIED"
  },
  "target_collision": {
    "collision_index_ref": null,
    "collision_index_sha256": null,
    "conflicting_candidate_keys": [],
    "evidence_refs": [],
    "status": "UNJUDGEABLE"
  }
}
