{
  "binding_status": "COMPLETE",
  "candidate_key": {
    "candidate_id": "candidate_585cf63d0ddbd71e09011fbf",
    "candidate_version": "8a91b72c0cb4f723b1e0604dcb4479b523a6cb88c9a16593da85689f9b553aa2",
    "candidate_vi": "lỗi khái quát hóa",
    "dataset_manifest_sha256": "7b256808dacf446b06bc4f6cdc0ab8f0aa7585a2a4e3a56364cdb3508d17fbdc",
    "effective_sense_contract_sha256": "39766250ef067687a75d2822b1b897bcb67b3fa2dad293cbe1f77b9ce1a07c77",
    "scope_id": "d2l_selected_campaign_scope_v1",
    "sense_id": "d2lce_9199c3ba27076b186a42df23",
    "sense_inventory_version": "d2l_dataset_50_senses_150_candidates_v1",
    "source_term": "generalization error"
  },
  "input_contract_sha256": "7d19cc6481e43bd37927701551fe4cce7343df553c51efccd210507dbbdb6541",
  "integrity": {
    "self_sha256": "25c64ac947b0b216cc5b30be74083f509bffa99e07357ffbdc513d132f08c70f"
  },
  "polysemy_resolution": {
    "authority_ref": {
      "evidence_id": "review-binding-d2lce_9199c3ba27076b186a42df23",
      "evidence_type": "REVIEW_ARTIFACT",
      "sha256": "9bebfd9ebe1ee120e7764e0e3bd2dd0cdbb3ef62cdf3f04c6b6424ed3cb66dc8",
      "uri": "artifact://d2l-dataset-50/stage_a_review_bindings/d2lce_9199c3ba27076b186a42df23.json"
    },
    "related_sense_ids": [
      "d2lce_9199c3ba27076b186a42df23"
    ],
    "status": "RESOLVED_SINGLE"
  },
  "provenance": {
    "completed_at": "2026-07-29T17:00:00Z",
    "component_id": "d2l-dataset-constraint-projector",
    "component_version": "1.0.0",
    "execution_config_sha256": "cf027ff8d20c1d2ecd0c667ab303fc31f25a9eda80257b61329c34e67efcd05d",
    "model_routes": [],
    "notes": "Stage A constraints are bound; candidate gold, C/E evidence, and final glossary decision remain unassigned.",
    "policy_version": "d2l-dataset-50-senses-150-candidates-stage-b-v1.0",
    "prompt_hashes": {},
    "raw_ledger_ref": null,
    "run_id": "d2l-dataset-50-sense-contract-release",
    "run_spec_id": "d2l-dataset-50-sense-contract-spec-v1",
    "source_artifact_hashes": {
      "adjudication_manifest": "95482cd1b495b9014a1f00ba4695324f99f0637c6fb96f17d5ffded44c5e2b5c",
      "base_dataset_manifest": "92fab6032576a5c9c57fe38e23b6c622d5f73718a897197a2c10df35c7fe8b4d",
      "base_dataset_manifest_physical": "438dffc84aaa735e4f734d4dc5cefcf63dc8360743b6e941380bca71eec1f13a",
      "candidate_instance": "8a91b72c0cb4f723b1e0604dcb4479b523a6cb88c9a16593da85689f9b553aa2",
      "r0_result_manifest": "c17198864aeb47233fd658d7e6c333c5beb86c5531e5b240ca30e046d066a616",
      "review_binding": "9bebfd9ebe1ee120e7764e0e3bd2dd0cdbb3ef62cdf3f04c6b6424ed3cb66dc8",
      "review_intake_manifest": "bcb840616060473ea61b81ca7cf052eff2ac00caeb7bff75e7cbf064e6a7e178",
      "term_sense": "2d6600edb73c5696f77593c5d17cf301cdd15b7640293935a13d919f52b8b642"
    },
    "started_at": "2026-07-29T17:00:00Z"
  },
  "schema_id": "ConstraintEvidencePackageV1",
  "schema_version": "1.1.0",
  "sense_review": {
    "effective_sense_contract_sha256": "39766250ef067687a75d2822b1b897bcb67b3fa2dad293cbe1f77b9ce1a07c77",
    "review_artifact_ref": {
      "evidence_id": "review-binding-d2lce_9199c3ba27076b186a42df23",
      "evidence_type": "REVIEW_ARTIFACT",
      "sha256": "9bebfd9ebe1ee120e7764e0e3bd2dd0cdbb3ef62cdf3f04c6b6424ed3cb66dc8",
      "uri": "artifact://d2l-dataset-50/stage_a_review_bindings/d2lce_9199c3ba27076b186a42df23.json"
    },
    "status": "VERIFIED"
  },
  "target_collision": {
    "collision_index_ref": null,
    "collision_index_sha256": null,
    "conflicting_candidate_keys": [],
    "evidence_refs": [],
    "status": "UNJUDGEABLE"
  }
}
