{
  "binding_status": "COMPLETE",
  "candidate_key": {
    "candidate_id": "candidate_a6d5cf26bae3db5051520575",
    "candidate_version": "c9cdb96bd9464546603c955ceabde71f8771a9b426ad975d2557e2166aae6024",
    "candidate_vi": "trung bình bình phương sai số",
    "dataset_manifest_sha256": "7b256808dacf446b06bc4f6cdc0ab8f0aa7585a2a4e3a56364cdb3508d17fbdc",
    "effective_sense_contract_sha256": "c10c2764f3ceda3d226ca25cb540d42dd2ee924f417212300ab6fd8887e415e7",
    "scope_id": "d2l_selected_campaign_scope_v1",
    "sense_id": "d2lce_49603071e9c21eb4bcbdf1e7",
    "sense_inventory_version": "d2l_dataset_50_senses_150_candidates_v1",
    "source_term": "mean squared error"
  },
  "input_contract_sha256": "bead03a59b6ef7736fbac8b41cca124f90616db2c2751aba99d764feab2e43b9",
  "integrity": {
    "self_sha256": "9b2db789f28a66abf23bf7226aa1faf91bd1f6d9915b65e37690305fdde939a3"
  },
  "polysemy_resolution": {
    "authority_ref": {
      "evidence_id": "review-binding-d2lce_49603071e9c21eb4bcbdf1e7",
      "evidence_type": "REVIEW_ARTIFACT",
      "sha256": "e2d235e685dfd10e8d71ae7e5755fc9a8dde622246eb46ed0d5d3ce6593a2b92",
      "uri": "artifact://d2l-dataset-50/stage_a_review_bindings/d2lce_49603071e9c21eb4bcbdf1e7.json"
    },
    "related_sense_ids": [
      "d2lce_49603071e9c21eb4bcbdf1e7"
    ],
    "status": "RESOLVED_SINGLE"
  },
  "provenance": {
    "completed_at": "2026-07-29T17:00:00Z",
    "component_id": "d2l-dataset-constraint-projector",
    "component_version": "1.0.0",
    "execution_config_sha256": "cf027ff8d20c1d2ecd0c667ab303fc31f25a9eda80257b61329c34e67efcd05d",
    "model_routes": [],
    "notes": "Stage A constraints are bound; candidate gold, C/E evidence, and final glossary decision remain unassigned.",
    "policy_version": "d2l-dataset-50-senses-150-candidates-stage-b-v1.0",
    "prompt_hashes": {},
    "raw_ledger_ref": null,
    "run_id": "d2l-dataset-50-sense-contract-release",
    "run_spec_id": "d2l-dataset-50-sense-contract-spec-v1",
    "source_artifact_hashes": {
      "adjudication_manifest": "95482cd1b495b9014a1f00ba4695324f99f0637c6fb96f17d5ffded44c5e2b5c",
      "base_dataset_manifest": "92fab6032576a5c9c57fe38e23b6c622d5f73718a897197a2c10df35c7fe8b4d",
      "base_dataset_manifest_physical": "438dffc84aaa735e4f734d4dc5cefcf63dc8360743b6e941380bca71eec1f13a",
      "candidate_instance": "c9cdb96bd9464546603c955ceabde71f8771a9b426ad975d2557e2166aae6024",
      "r0_result_manifest": "c17198864aeb47233fd658d7e6c333c5beb86c5531e5b240ca30e046d066a616",
      "review_binding": "e2d235e685dfd10e8d71ae7e5755fc9a8dde622246eb46ed0d5d3ce6593a2b92",
      "review_intake_manifest": "bcb840616060473ea61b81ca7cf052eff2ac00caeb7bff75e7cbf064e6a7e178",
      "term_sense": "7c7882be803045744720286c097961a9893d71e6ee60a52f26533a3243cfe7ad"
    },
    "started_at": "2026-07-29T17:00:00Z"
  },
  "schema_id": "ConstraintEvidencePackageV1",
  "schema_version": "1.1.0",
  "sense_review": {
    "effective_sense_contract_sha256": "c10c2764f3ceda3d226ca25cb540d42dd2ee924f417212300ab6fd8887e415e7",
    "review_artifact_ref": {
      "evidence_id": "review-binding-d2lce_49603071e9c21eb4bcbdf1e7",
      "evidence_type": "REVIEW_ARTIFACT",
      "sha256": "e2d235e685dfd10e8d71ae7e5755fc9a8dde622246eb46ed0d5d3ce6593a2b92",
      "uri": "artifact://d2l-dataset-50/stage_a_review_bindings/d2lce_49603071e9c21eb4bcbdf1e7.json"
    },
    "status": "VERIFIED"
  },
  "target_collision": {
    "collision_index_ref": null,
    "collision_index_sha256": null,
    "conflicting_candidate_keys": [],
    "evidence_refs": [],
    "status": "UNJUDGEABLE"
  }
}
