{
  "binding_status": "COMPLETE",
  "candidate_key": {
    "candidate_id": "candidate_e3d9283d0e0d001486b0eaad",
    "candidate_version": "3930c932c8e7823bc4e285a67b7f3ba60a92f70b32ee9e705803104f177023d9",
    "candidate_vi": "chuẩn độ dài",
    "dataset_manifest_sha256": "7b256808dacf446b06bc4f6cdc0ab8f0aa7585a2a4e3a56364cdb3508d17fbdc",
    "effective_sense_contract_sha256": "6ad4b6b64d13c27982c95f5b6f7dc1cdfa8f76462b38890046c57d5b3614ca45",
    "scope_id": "d2l_selected_campaign_scope_v1",
    "sense_id": "d2lce_3e633e212e54590ca20bfc99",
    "sense_inventory_version": "d2l_dataset_50_senses_150_candidates_v1",
    "source_term": "norm"
  },
  "input_contract_sha256": "eb0e4f80c707551d49dd1d370e09a027950f5747b15693de3d04c8a96d28179c",
  "integrity": {
    "self_sha256": "819e15394c680a59c39f0a0f7c2778c21d24ae97badc6fadeb17202904ab3cb0"
  },
  "polysemy_resolution": {
    "authority_ref": {
      "evidence_id": "review-binding-d2lce_3e633e212e54590ca20bfc99",
      "evidence_type": "REVIEW_ARTIFACT",
      "sha256": "889aff3d822edc9eea2ca9f2f74711b64cd6efab54209d267fdc524c91906277",
      "uri": "artifact://d2l-dataset-50/stage_a_review_bindings/d2lce_3e633e212e54590ca20bfc99.json"
    },
    "related_sense_ids": [
      "d2lce_3e633e212e54590ca20bfc99"
    ],
    "status": "RESOLVED_SINGLE"
  },
  "provenance": {
    "completed_at": "2026-07-29T17:00:00Z",
    "component_id": "d2l-dataset-constraint-projector",
    "component_version": "1.0.0",
    "execution_config_sha256": "cf027ff8d20c1d2ecd0c667ab303fc31f25a9eda80257b61329c34e67efcd05d",
    "model_routes": [],
    "notes": "Stage A constraints are bound; candidate gold, C/E evidence, and final glossary decision remain unassigned.",
    "policy_version": "d2l-dataset-50-senses-150-candidates-stage-b-v1.0",
    "prompt_hashes": {},
    "raw_ledger_ref": null,
    "run_id": "d2l-dataset-50-sense-contract-release",
    "run_spec_id": "d2l-dataset-50-sense-contract-spec-v1",
    "source_artifact_hashes": {
      "adjudication_manifest": "95482cd1b495b9014a1f00ba4695324f99f0637c6fb96f17d5ffded44c5e2b5c",
      "base_dataset_manifest": "92fab6032576a5c9c57fe38e23b6c622d5f73718a897197a2c10df35c7fe8b4d",
      "base_dataset_manifest_physical": "438dffc84aaa735e4f734d4dc5cefcf63dc8360743b6e941380bca71eec1f13a",
      "candidate_instance": "3930c932c8e7823bc4e285a67b7f3ba60a92f70b32ee9e705803104f177023d9",
      "r0_result_manifest": "c17198864aeb47233fd658d7e6c333c5beb86c5531e5b240ca30e046d066a616",
      "review_binding": "889aff3d822edc9eea2ca9f2f74711b64cd6efab54209d267fdc524c91906277",
      "review_intake_manifest": "bcb840616060473ea61b81ca7cf052eff2ac00caeb7bff75e7cbf064e6a7e178",
      "term_sense": "6e161633d54d1dbd43f03bed8ee8fd7b9330f789489ae04e87b4b8a95e8ec26a"
    },
    "started_at": "2026-07-29T17:00:00Z"
  },
  "schema_id": "ConstraintEvidencePackageV1",
  "schema_version": "1.1.0",
  "sense_review": {
    "effective_sense_contract_sha256": "6ad4b6b64d13c27982c95f5b6f7dc1cdfa8f76462b38890046c57d5b3614ca45",
    "review_artifact_ref": {
      "evidence_id": "review-binding-d2lce_3e633e212e54590ca20bfc99",
      "evidence_type": "REVIEW_ARTIFACT",
      "sha256": "889aff3d822edc9eea2ca9f2f74711b64cd6efab54209d267fdc524c91906277",
      "uri": "artifact://d2l-dataset-50/stage_a_review_bindings/d2lce_3e633e212e54590ca20bfc99.json"
    },
    "status": "VERIFIED"
  },
  "target_collision": {
    "collision_index_ref": null,
    "collision_index_sha256": null,
    "conflicting_candidate_keys": [],
    "evidence_refs": [],
    "status": "UNJUDGEABLE"
  }
}
