{
  "binding_status": "COMPLETE",
  "candidate_key": {
    "candidate_id": "candidate_afd1db76bd336c7e5427c274",
    "candidate_version": "01085904643fb8066b1a423cb4a322a0adc2bb2c71d9f130f667aee8f502407d",
    "candidate_vi": "chuẩn PCIe",
    "dataset_manifest_sha256": "7b256808dacf446b06bc4f6cdc0ab8f0aa7585a2a4e3a56364cdb3508d17fbdc",
    "effective_sense_contract_sha256": "c7b707f8c0a02a11a01d3403d96beb32181dbc36aab8edb27d1f5d859a20432a",
    "scope_id": "d2l_selected_campaign_scope_v1",
    "sense_id": "d2lce_35df896f9860f8aac814ce37",
    "sense_inventory_version": "d2l_dataset_50_senses_150_candidates_v1",
    "source_term": "PCIe"
  },
  "input_contract_sha256": "f41b9e17a9e0bc32e9af86b1b09ef671a16bbda8de5114de048ffa6b630536f3",
  "integrity": {
    "self_sha256": "7f0d90c26177ec9e77dadddaa0826850a9913c2ddcaa0de91ce27120a8c54d7b"
  },
  "polysemy_resolution": {
    "authority_ref": {
      "evidence_id": "review-binding-d2lce_35df896f9860f8aac814ce37",
      "evidence_type": "REVIEW_ARTIFACT",
      "sha256": "911a3afba4e5f16d66e6a6c35ff7438125ef1b4da1c8c3399a95e85a6cfb174e",
      "uri": "artifact://d2l-dataset-50/stage_a_review_bindings/d2lce_35df896f9860f8aac814ce37.json"
    },
    "related_sense_ids": [
      "d2lce_35df896f9860f8aac814ce37"
    ],
    "status": "RESOLVED_SINGLE"
  },
  "provenance": {
    "completed_at": "2026-07-29T17:00:00Z",
    "component_id": "d2l-dataset-constraint-projector",
    "component_version": "1.0.0",
    "execution_config_sha256": "cf027ff8d20c1d2ecd0c667ab303fc31f25a9eda80257b61329c34e67efcd05d",
    "model_routes": [],
    "notes": "Stage A constraints are bound; candidate gold, C/E evidence, and final glossary decision remain unassigned.",
    "policy_version": "d2l-dataset-50-senses-150-candidates-stage-b-v1.0",
    "prompt_hashes": {},
    "raw_ledger_ref": null,
    "run_id": "d2l-dataset-50-sense-contract-release",
    "run_spec_id": "d2l-dataset-50-sense-contract-spec-v1",
    "source_artifact_hashes": {
      "adjudication_manifest": "95482cd1b495b9014a1f00ba4695324f99f0637c6fb96f17d5ffded44c5e2b5c",
      "base_dataset_manifest": "92fab6032576a5c9c57fe38e23b6c622d5f73718a897197a2c10df35c7fe8b4d",
      "base_dataset_manifest_physical": "438dffc84aaa735e4f734d4dc5cefcf63dc8360743b6e941380bca71eec1f13a",
      "candidate_instance": "01085904643fb8066b1a423cb4a322a0adc2bb2c71d9f130f667aee8f502407d",
      "r0_result_manifest": "c17198864aeb47233fd658d7e6c333c5beb86c5531e5b240ca30e046d066a616",
      "review_binding": "911a3afba4e5f16d66e6a6c35ff7438125ef1b4da1c8c3399a95e85a6cfb174e",
      "review_intake_manifest": "bcb840616060473ea61b81ca7cf052eff2ac00caeb7bff75e7cbf064e6a7e178",
      "term_sense": "24f19fe483534ea0e773776bc37f78f6d2bb3ee8201d5294d6466188b3ff179d"
    },
    "started_at": "2026-07-29T17:00:00Z"
  },
  "schema_id": "ConstraintEvidencePackageV1",
  "schema_version": "1.1.0",
  "sense_review": {
    "effective_sense_contract_sha256": "c7b707f8c0a02a11a01d3403d96beb32181dbc36aab8edb27d1f5d859a20432a",
    "review_artifact_ref": {
      "evidence_id": "review-binding-d2lce_35df896f9860f8aac814ce37",
      "evidence_type": "REVIEW_ARTIFACT",
      "sha256": "911a3afba4e5f16d66e6a6c35ff7438125ef1b4da1c8c3399a95e85a6cfb174e",
      "uri": "artifact://d2l-dataset-50/stage_a_review_bindings/d2lce_35df896f9860f8aac814ce37.json"
    },
    "status": "VERIFIED"
  },
  "target_collision": {
    "collision_index_ref": null,
    "collision_index_sha256": null,
    "conflicting_candidate_keys": [],
    "evidence_refs": [],
    "status": "UNJUDGEABLE"
  }
}
